{
  "access_state": "clear_restricted",
  "document_id": "document_example001",
  "encryption": {
    "encrypted": false,
    "scheme": null,
    "secret_ref_audited": false,
    "secret_used": false
  },
  "error_refs": [],
  "header": {
    "content_hash": "d1ed46a0b6423658c1310c3ce7636ccb3181141f36f420eb9c0559ea6c6d25ad",
    "contract_id": "access_contract_example001",
    "created_at": "2026-06-19T20:00:00Z",
    "extensions": {},
    "producer": "vysi.document_source",
    "producer_version": "0.2.0",
    "revision": 1,
    "schema_id": "document_source.access_clearance",
    "schema_version": "2.0.0",
    "status": "ok",
    "supersedes": null
  },
  "restrictions": [
    "active_content_inert"
  ],
  "signature_state": "absent"
}
